<?xml version="1.0" encoding="UTF-8"?>

<!-- W3C Schema generated by XMLSpy v2026 rel. 2 (x64) (https://www.altova.com) -->
<xs:schema xmlns:xs="http://www.w3.org/2001/XMLSchema" xmlns:xsi="https://www.w3.org/2001/XMLSchema.xsd">
	<xs:element name="classic-cars">
		<xs:complexType>
			<xs:sequence>
				<xs:element ref="vehicle" maxOccurs="unbounded"/>
			</xs:sequence>
			<xs:attribute ref="xsi:noNamespaceSchemaLocation" use="required"/>
		</xs:complexType>
	</xs:element>
	<xs:element name="company">
		<xs:simpleType>
			<xs:restriction base="xs:string">
				<xs:enumeration value="FCA Italy"/>
				<xs:enumeration value="Honda"/>
				<xs:enumeration value="Mercedes-Benz"/>
				<xs:enumeration value="Toyota"/>
			</xs:restriction>
		</xs:simpleType>
	</xs:element>
	<xs:element name="country">
		<xs:simpleType>
			<xs:restriction base="xs:string">
				<xs:enumeration value="Germany"/>
				<xs:enumeration value="Italy"/>
				<xs:enumeration value="Japan"/>
			</xs:restriction>
		</xs:simpleType>
	</xs:element>
	<xs:element name="model" type="xs:string"/>
	<xs:element name="price">
		<xs:simpleType>
			<xs:restriction base="xs:short">
				<xs:enumeration value="12000"/>
				<xs:enumeration value="15000"/>
				<xs:enumeration value="17000"/>
				<xs:enumeration value="2000"/>
				<xs:enumeration value="20000"/>
				<xs:enumeration value="23000"/>
				<xs:enumeration value="25000"/>
				<xs:enumeration value="27000"/>
				<xs:enumeration value="3000"/>
				<xs:enumeration value="5000"/>
				<xs:enumeration value="6000"/>
				<xs:enumeration value="8000"/>
				<xs:enumeration value="9000"/>
			</xs:restriction>
		</xs:simpleType>
	</xs:element>
	<xs:element name="vehicle">
		<xs:complexType>
			<xs:sequence>
				<xs:element ref="model"/>
				<xs:element ref="country"/>
				<xs:element ref="company"/>
				<xs:element ref="price"/>
				<xs:element ref="year"/>
			</xs:sequence>
		</xs:complexType>
	</xs:element>
	<xs:element name="year">
		<xs:simpleType>
			<xs:restriction base="xs:string">
				<xs:enumeration value="1953"/>
				<xs:enumeration value="1982"/>
				<xs:enumeration value="1986"/>
				<xs:enumeration value="1993"/>
				<xs:enumeration value="1994"/>
				<xs:enumeration value="1997"/>
				<xs:enumeration value="2000"/>
				<xs:enumeration value="2003"/>
				<xs:enumeration value="2008"/>
				<xs:enumeration value="2018"/>
				<xs:enumeration value="2022"/>
				<xs:enumeration value="2025"/>
			</xs:restriction>
		</xs:simpleType>
	</xs:element>
</xs:schema>
